<?xml version="1.0" encoding="UTF-8" standalone="yes" ?>
<?codewarrior exportversion="2.0" ideversion="5.9.0" ?>

<!DOCTYPE PROJECT [
<!ELEMENT PROJECT (TARGETLIST, TARGETORDER, GROUPLIST, DESIGNLIST?, PLUGINDATALIST?)>
<!ELEMENT TARGETLIST (TARGET+)>
<!ELEMENT TARGET (NAME, SETTINGLIST, FILELIST, LINKORDER?, SEGMENTLIST?, OVERLAYGROUPLIST?, SUBTARGETLIST?, SUBPROJECTLIST?, FRAMEWORKLIST?, PACKAGEACTIONSLIST?)>
<!ELEMENT PACKAGEACTIONSLIST (PACKAGEACTION+)>
<!ELEMENT PACKAGEACTION (#PCDATA)>
<!ATTLIST PACKAGEACTION PACKAGEACTIONTYPE CDATA #REQUIRED>
<!ELEMENT NAME (#PCDATA)>
<!ELEMENT PATH (#PCDATA)>
<!ELEMENT FILELIST (FILE*)>
<!ELEMENT FILE (PATHTYPE, PATHROOT?, ACCESSPATH?, PATH, PATHFORMAT, ROOTFILEREF?, FILEKIND, FILEFLAGS)>
<!ELEMENT PATHTYPE (#PCDATA)>
<!ELEMENT PATHROOT (#PCDATA)>
<!ELEMENT ACCESSPATH (#PCDATA)>
<!ELEMENT PATHFORMAT (#PCDATA)>
<!ELEMENT ROOTFILEREF (PATHTYPE, PATHROOT?, ACCESSPATH?, PATH, PATHFORMAT)>
<!ELEMENT FILEKIND (#PCDATA)>
<!ELEMENT FILEFLAGS (#PCDATA)>
<!ELEMENT FILEREF (TARGETNAME?, PATHTYPE, PATHROOT?, ACCESSPATH?, PATH, PATHFORMAT)>
<!ELEMENT TARGETNAME (#PCDATA)>
<!ELEMENT SETTINGLIST ((SETTING|PANELDATA)*)>
<!ELEMENT SETTING (NAME?, (VALUE|(SETTING+)))>
<!ELEMENT PANELDATA (NAME, VALUE)>
<!ELEMENT VALUE (#PCDATA)>
<!ELEMENT LINKORDER (FILEREF*)>
<!ELEMENT SEGMENTLIST (SEGMENT+)>
<!ELEMENT SEGMENT (NAME?, ATTRIBUTES?, FILEREF*)>
<!ELEMENT ATTRIBUTES (#PCDATA)>
<!ELEMENT OVERLAYGROUPLIST (OVERLAYGROUP+)>
<!ELEMENT OVERLAYGROUP (NAME, BASEADDRESS, OVERLAY*)>
<!ELEMENT BASEADDRESS (#PCDATA)>
<!ELEMENT OVERLAY (NAME, FILEREF*)>
<!ELEMENT SUBTARGETLIST (SUBTARGET+)>
<!ELEMENT TARGETOUTPUTNAME (#PCDATA)>
<!ELEMENT TARGETOUTPUTDISPLAYNAME (#PCDATA)>
<!ELEMENT TARGETOUTPUTPATHFORMAT (#PCDATA)>
<!ELEMENT TARGETOUTPUTACCESSTYPE (#PCDATA)>
<!ELEMENT SUBTARGET (TARGETNAME, ATTRIBUTES?, TARGETOUTPUTNAME?, TARGETOUTPUTDISPLAYNAME?, TARGETOUTPUTPATHFORMAT?, TARGETOUTPUTACCESSTYPE?, FILEREF?)>
<!ELEMENT SUBPROJECTLIST (SUBPROJECT+)>
<!ELEMENT SUBPROJECT (FILEREF, SUBPROJECTTARGETLIST)>
<!ELEMENT SUBPROJECTTARGETLIST (SUBPROJECTTARGET*)>
<!ELEMENT SUBPROJECTTARGET (TARGETNAME, ATTRIBUTES?, FILEREF?)>
<!ELEMENT FRAMEWORKLIST (FRAMEWORK+)>
<!ELEMENT FRAMEWORK (FILEREF, VERSION?, DYNAMICLIBRARY?)>
<!ELEMENT DYNAMICLIBRARY (#PCDATA)>
<!ELEMENT VERSION (#PCDATA)>
<!ELEMENT TARGETORDER (ORDEREDTARGET|ORDEREDDESIGN)*>
<!ELEMENT ORDEREDTARGET (NAME)>
<!ELEMENT ORDEREDDESIGN (NAME, ORDEREDTARGET+)>
<!ELEMENT GROUPLIST (GROUP|FILEREF)*>
<!ELEMENT GROUP (NAME, (GROUP|FILEREF)*)>
<!ELEMENT DESIGNLIST (DESIGN+)>
<!ELEMENT DESIGN (NAME, DESIGNDATA)>
<!ELEMENT DESIGNDATA (#PCDATA)>
<!ELEMENT PLUGINDATALIST (PLUGINDATA+)>
<!ELEMENT PLUGINDATA (NAME, VALUE)>
]>

<PROJECT>
    <TARGETLIST>
        <TARGET>
            <NAME>P&amp;E Multilink CyclonePro</NAME>
            <SETTINGLIST>

                <!-- Settings for "Source Trees" panel -->
                <SETTING><NAME>UserSourceTrees</NAME><VALUE></VALUE></SETTING>

                <!-- Settings for "Access Paths" panel -->
                <SETTING><NAME>AlwaysSearchUserPaths</NAME><VALUE>false</VALUE></SETTING>
                <SETTING><NAME>InterpretDOSAndUnixPaths</NAME><VALUE>false</VALUE></SETTING>
                <SETTING><NAME>RequireFrameworkStyleIncludes</NAME><VALUE>false</VALUE></SETTING>
                <SETTING><NAME>SourceRelativeIncludes</NAME><VALUE>false</VALUE></SETTING>
                <SETTING><NAME>UserSearchPaths</NAME>
                    <SETTING>
                        <SETTING><NAME>SearchPath</NAME>
                            <SETTING><NAME>Path</NAME><VALUE></VALUE></SETTING>
                            <SETTING><NAME>PathFormat</NAME><VALUE>Windows</VALUE></SETTING>
                            <SETTING><NAME>PathRoot</NAME><VALUE>Project</VALUE></SETTING>
                        </SETTING>
                        <SETTING><NAME>Recursive</NAME><VALUE>false</VALUE></SETTING>
                        <SETTING><NAME>FrameworkPath</NAME><VALUE>false</VALUE></SETTING>
                        <SETTING><NAME>HostFlags</NAME><VALUE>All</VALUE></SETTING>
                    </SETTING>
                    <SETTING>
                        <SETTING><NAME>SearchPath</NAME>
                            <SETTING><NAME>Path</NAME><VALUE>bin</VALUE></SETTING>
                            <SETTING><NAME>PathFormat</NAME><VALUE>Windows</VALUE></SETTING>
                            <SETTING><NAME>PathRoot</NAME><VALUE>Project</VALUE></SETTING>
                        </SETTING>
                        <SETTING><NAME>Recursive</NAME><VALUE>false</VALUE></SETTING>
                        <SETTING><NAME>FrameworkPath</NAME><VALUE>false</VALUE></SETTING>
                        <SETTING><NAME>HostFlags</NAME><VALUE>All</VALUE></SETTING>
                    </SETTING>
                    <SETTING>
                        <SETTING><NAME>SearchPath</NAME>
                            <SETTING><NAME>Path</NAME><VALUE>prm</VALUE></SETTING>
                            <SETTING><NAME>PathFormat</NAME><VALUE>Windows</VALUE></SETTING>
                            <SETTING><NAME>PathRoot</NAME><VALUE>Project</VALUE></SETTING>
                        </SETTING>
                        <SETTING><NAME>Recursive</NAME><VALUE>false</VALUE></SETTING>
                        <SETTING><NAME>FrameworkPath</NAME><VALUE>false</VALUE></SETTING>
                        <SETTING><NAME>HostFlags</NAME><VALUE>All</VALUE></SETTING>
                    </SETTING>
                    <SETTING>
                        <SETTING><NAME>SearchPath</NAME>
                            <SETTING><NAME>Path</NAME><VALUE>cmd</VALUE></SETTING>
                            <SETTING><NAME>PathFormat</NAME><VALUE>Windows</VALUE></SETTING>
                            <SETTING><NAME>PathRoot</NAME><VALUE>Project</VALUE></SETTING>
                        </SETTING>
                        <SETTING><NAME>Recursive</NAME><VALUE>false</VALUE></SETTING>
                        <SETTING><NAME>FrameworkPath</NAME><VALUE>false</VALUE></SETTING>
                        <SETTING><NAME>HostFlags</NAME><VALUE>All</VALUE></SETTING>
                    </SETTING>
                    <SETTING>
                        <SETTING><NAME>SearchPath</NAME>
                            <SETTING><NAME>Path</NAME><VALUE>Sources</VALUE></SETTING>
                            <SETTING><NAME>PathFormat</NAME><VALUE>Windows</VALUE></SETTING>
                            <SETTING><NAME>PathRoot</NAME><VALUE>Project</VALUE></SETTING>
                        </SETTING>
                        <SETTING><NAME>Recursive</NAME><VALUE>false</VALUE></SETTING>
                        <SETTING><NAME>FrameworkPath</NAME><VALUE>false</VALUE></SETTING>
                        <SETTING><NAME>HostFlags</NAME><VALUE>All</VALUE></SETTING>
                    </SETTING>
                    <SETTING>
                        <SETTING><NAME>SearchPath</NAME>
                            <SETTING><NAME>Path</NAME><VALUE>lib\HC12c\lib</VALUE></SETTING>
                            <SETTING><NAME>PathFormat</NAME><VALUE>Windows</VALUE></SETTING>
                            <SETTING><NAME>PathRoot</NAME><VALUE>CodeWarrior</VALUE></SETTING>
                        </SETTING>
                        <SETTING><NAME>Recursive</NAME><VALUE>false</VALUE></SETTING>
                        <SETTING><NAME>FrameworkPath</NAME><VALUE>false</VALUE></SETTING>
                        <SETTING><NAME>HostFlags</NAME><VALUE>All</VALUE></SETTING>
                    </SETTING>
                    <SETTING>
                        <SETTING><NAME>SearchPath</NAME>
                            <SETTING><NAME>Path</NAME><VALUE>lib\HC12c\src</VALUE></SETTING>
                            <SETTING><NAME>PathFormat</NAME><VALUE>Windows</VALUE></SETTING>
                            <SETTING><NAME>PathRoot</NAME><VALUE>CodeWarrior</VALUE></SETTING>
                        </SETTING>
                        <SETTING><NAME>Recursive</NAME><VALUE>false</VALUE></SETTING>
                        <SETTING><NAME>FrameworkPath</NAME><VALUE>false</VALUE></SETTING>
                        <SETTING><NAME>HostFlags</NAME><VALUE>All</VALUE></SETTING>
                    </SETTING>
                    <SETTING>
                        <SETTING><NAME>SearchPath</NAME>
                            <SETTING><NAME>Path</NAME><VALUE>lib</VALUE></SETTING>
                            <SETTING><NAME>PathFormat</NAME><VALUE>Windows</VALUE></SETTING>
                            <SETTING><NAME>PathRoot</NAME><VALUE>Project</VALUE></SETTING>
                        </SETTING>
                        <SETTING><NAME>Recursive</NAME><VALUE>false</VALUE></SETTING>
                        <SETTING><NAME>FrameworkPath</NAME><VALUE>false</VALUE></SETTING>
                        <SETTING><NAME>HostFlags</NAME><VALUE>All</VALUE></SETTING>
                    </SETTING>
                    <SETTING>
                        <SETTING><NAME>SearchPath</NAME>
                            <SETTING><NAME>Path</NAME><VALUE>..\..\ooc\lib</VALUE></SETTING>
                            <SETTING><NAME>PathFormat</NAME><VALUE>Windows</VALUE></SETTING>
                            <SETTING><NAME>PathRoot</NAME><VALUE>Project</VALUE></SETTING>
                        </SETTING>
                        <SETTING><NAME>Recursive</NAME><VALUE>false</VALUE></SETTING>
                        <SETTING><NAME>FrameworkPath</NAME><VALUE>false</VALUE></SETTING>
                        <SETTING><NAME>HostFlags</NAME><VALUE>All</VALUE></SETTING>
                    </SETTING>
                </SETTING>
                <SETTING><NAME>SystemSearchPaths</NAME>
                    <SETTING>
                        <SETTING><NAME>SearchPath</NAME>
                            <SETTING><NAME>Path</NAME><VALUE>lib\HC12c\include</VALUE></SETTING>
                            <SETTING><NAME>PathFormat</NAME><VALUE>Windows</VALUE></SETTING>
                            <SETTING><NAME>PathRoot</NAME><VALUE>CodeWarrior</VALUE></SETTING>
                        </SETTING>
                        <SETTING><NAME>Recursive</NAME><VALUE>false</VALUE></SETTING>
                        <SETTING><NAME>FrameworkPath</NAME><VALUE>false</VALUE></SETTING>
                        <SETTING><NAME>HostFlags</NAME><VALUE>All</VALUE></SETTING>
                    </SETTING>
                </SETTING>

                <!-- Settings for "Target Settings" panel -->
                <SETTING><NAME>Linker</NAME><VALUE>Libmaker for HC12</VALUE></SETTING>
                <SETTING><NAME>PreLinker</NAME><VALUE></VALUE></SETTING>
                <SETTING><NAME>PostLinker</NAME><VALUE></VALUE></SETTING>
                <SETTING><NAME>Targetname</NAME><VALUE>P&amp;E Multilink CyclonePro</VALUE></SETTING>
                <SETTING><NAME>OutputDirectory</NAME>
                    <SETTING><NAME>Path</NAME><VALUE>lib_cpp</VALUE></SETTING>
                    <SETTING><NAME>PathFormat</NAME><VALUE>Windows</VALUE></SETTING>
                    <SETTING><NAME>PathRoot</NAME><VALUE>Project</VALUE></SETTING>
                </SETTING>
                <SETTING><NAME>SaveEntriesUsingRelativePaths</NAME><VALUE>false</VALUE></SETTING>

                <!-- Settings for "File Mappings" panel -->
                <SETTING><NAME>FileMappings</NAME>
                    <SETTING>
                        <SETTING><NAME>FileType</NAME><VALUE>TEXT</VALUE></SETTING>
                        <SETTING><NAME>FileExtension</NAME><VALUE>.a12</VALUE></SETTING>
                        <SETTING><NAME>Compiler</NAME><VALUE>Assembler for HC12</VALUE></SETTING>
                        <SETTING><NAME>EditLanguage</NAME><VALUE>mwe_asm_HC12</VALUE></SETTING>
                        <SETTING><NAME>Precompile</NAME><VALUE>false</VALUE></SETTING>
                        <SETTING><NAME>Launchable</NAME><VALUE>false</VALUE></SETTING>
                        <SETTING><NAME>ResourceFile</NAME><VALUE>false</VALUE></SETTING>
                        <SETTING><NAME>IgnoredByMake</NAME><VALUE>false</VALUE></SETTING>
                    </SETTING>
                    <SETTING>
                        <SETTING><NAME>FileType</NAME><VALUE>TEXT</VALUE></SETTING>
                        <SETTING><NAME>FileExtension</NAME><VALUE>.asm</VALUE></SETTING>
                        <SETTING><NAME>Compiler</NAME><VALUE>Assembler for HC12</VALUE></SETTING>
                        <SETTING><NAME>EditLanguage</NAME><VALUE>mwe_asm_HC12</VALUE></SETTING>
                        <SETTING><NAME>Precompile</NAME><VALUE>false</VALUE></SETTING>
                        <SETTING><NAME>Launchable</NAME><VALUE>false</VALUE></SETTING>
                        <SETTING><NAME>ResourceFile</NAME><VALUE>false</VALUE></SETTING>
                        <SETTING><NAME>IgnoredByMake</NAME><VALUE>false</VALUE></SETTING>
                    </SETTING>
                    <SETTING>
                        <SETTING><NAME>FileType</NAME><VALUE>TEXT</VALUE></SETTING>
                        <SETTING><NAME>FileExtension</NAME><VALUE>.axgate</VALUE></SETTING>
                        <SETTING><NAME>Compiler</NAME><VALUE>Assembler for XGATE</VALUE></SETTING>
                        <SETTING><NAME>EditLanguage</NAME><VALUE>mwe_asm_XGATE</VALUE></SETTING>
                        <SETTING><NAME>Precompile</NAME><VALUE>false</VALUE></SETTING>
                        <SETTING><NAME>Launchable</NAME><VALUE>false</VALUE></SETTING>
                        <SETTING><NAME>ResourceFile</NAME><VALUE>false</VALUE></SETTING>
                        <SETTING><NAME>IgnoredByMake</NAME><VALUE>false</VALUE></SETTING>
                    </SETTING>
                    <SETTING>
                        <SETTING><NAME>FileType</NAME><VALUE>TEXT</VALUE></SETTING>
                        <SETTING><NAME>FileExtension</NAME><VALUE>.bbl</VALUE></SETTING>
                        <SETTING><NAME>Compiler</NAME><VALUE></VALUE></SETTING>
                        <SETTING><NAME>EditLanguage</NAME><VALUE>mwe_bbl</VALUE></SETTING>
                        <SETTING><NAME>Precompile</NAME><VALUE>false</VALUE></SETTING>
                        <SETTING><NAME>Launchable</NAME><VALUE>false</VALUE></SETTING>
                        <SETTING><NAME>ResourceFile</NAME><VALUE>false</VALUE></SETTING>
                        <SETTING><NAME>IgnoredByMake</NAME><VALUE>false</VALUE></SETTING>
                    </SETTING>
                    <SETTING>
                        <SETTING><NAME>FileType</NAME><VALUE>TEXT</VALUE></SETTING>
                        <SETTING><NAME>FileExtension</NAME><VALUE>.c</VALUE></SETTING>
                        <SETTING><NAME>Compiler</NAME><VALUE>Compiler for HC12</VALUE></SETTING>
                        <SETTING><NAME>EditLanguage</NAME><VALUE>mwe_cpp_HC12</VALUE></SETTING>
                        <SETTING><NAME>Precompile</NAME><VALUE>false</VALUE></SETTING>
                        <SETTING><NAME>Launchable</NAME><VALUE>false</VALUE></SETTING>
                        <SETTING><NAME>ResourceFile</NAME><VALUE>false</VALUE></SETTING>
                        <SETTING><NAME>IgnoredByMake</NAME><VALUE>false</VALUE></SETTING>
                    </SETTING>
                    <SETTING>
                        <SETTING><NAME>FileType</NAME><VALUE>TEXT</VALUE></SETTING>
                        <SETTING><NAME>FileExtension</NAME><VALUE>.c12</VALUE></SETTING>
                        <SETTING><NAME>Compiler</NAME><VALUE>Compiler for HC12</VALUE></SETTING>
                        <SETTING><NAME>EditLanguage</NAME><VALUE>mwe_cpp_HC12</VALUE></SETTING>
                        <SETTING><NAME>Precompile</NAME><VALUE>false</VALUE></SETTING>
                        <SETTING><NAME>Launchable</NAME><VALUE>false</VALUE></SETTING>
                        <SETTING><NAME>ResourceFile</NAME><VALUE>false</VALUE></SETTING>
                        <SETTING><NAME>IgnoredByMake</NAME><VALUE>false</VALUE></SETTING>
                    </SETTING>
                    <SETTING>
                        <SETTING><NAME>FileType</NAME><VALUE>TEXT</VALUE></SETTING>
                        <SETTING><NAME>FileExtension</NAME><VALUE>.cc</VALUE></SETTING>
                        <SETTING><NAME>Compiler</NAME><VALUE>Compiler for HC12</VALUE></SETTING>
                        <SETTING><NAME>EditLanguage</NAME><VALUE>mwe_cpp_HC12</VALUE></SETTING>
                        <SETTING><NAME>Precompile</NAME><VALUE>false</VALUE></SETTING>
                        <SETTING><NAME>Launchable</NAME><VALUE>false</VALUE></SETTING>
                        <SETTING><NAME>ResourceFile</NAME><VALUE>false</VALUE></SETTING>
                        <SETTING><NAME>IgnoredByMake</NAME><VALUE>false</VALUE></SETTING>
                    </SETTING>
                    <SETTING>
                        <SETTING><NAME>FileType</NAME><VALUE>TEXT</VALUE></SETTING>
                        <SETTING><NAME>FileExtension</NAME><VALUE>.cmd</VALUE></SETTING>
                        <SETTING><NAME>Compiler</NAME><VALUE></VALUE></SETTING>
                        <SETTING><NAME>EditLanguage</NAME><VALUE></VALUE></SETTING>
                        <SETTING><NAME>Precompile</NAME><VALUE>false</VALUE></SETTING>
                        <SETTING><NAME>Launchable</NAME><VALUE>false</VALUE></SETTING>
                        <SETTING><NAME>ResourceFile</NAME><VALUE>false</VALUE></SETTING>
                        <SETTING><NAME>IgnoredByMake</NAME><VALUE>true</VALUE></SETTING>
                    </SETTING>
                    <SETTING>
                        <SETTING><NAME>FileType</NAME><VALUE>TEXT</VALUE></SETTING>
                        <SETTING><NAME>FileExtension</NAME><VALUE>.cp</VALUE></SETTING>
                        <SETTING><NAME>Compiler</NAME><VALUE>Compiler for HC12</VALUE></SETTING>
                        <SETTING><NAME>EditLanguage</NAME><VALUE>mwe_cpp_HC12</VALUE></SETTING>
                        <SETTING><NAME>Precompile</NAME><VALUE>false</VALUE></SETTING>
                        <SETTING><NAME>Launchable</NAME><VALUE>false</VALUE></SETTING>
                        <SETTING><NAME>ResourceFile</NAME><VALUE>false</VALUE></SETTING>
                        <SETTING><NAME>IgnoredByMake</NAME><VALUE>false</VALUE></SETTING>
                    </SETTING>
                    <SETTING>
                        <SETTING><NAME>FileType</NAME><VALUE>TEXT</VALUE></SETTING>
                        <SETTING><NAME>FileExtension</NAME><VALUE>.cpp</VALUE></SETTING>
                        <SETTING><NAME>Compiler</NAME><VALUE>Compiler for HC12</VALUE></SETTING>
                        <SETTING><NAME>EditLanguage</NAME><VALUE>mwe_cpp_HC12</VALUE></SETTING>
                        <SETTING><NAME>Precompile</NAME><VALUE>false</VALUE></SETTING>
                        <SETTING><NAME>Launchable</NAME><VALUE>false</VALUE></SETTING>
                        <SETTING><NAME>ResourceFile</NAME><VALUE>false</VALUE></SETTING>
                        <SETTING><NAME>IgnoredByMake</NAME><VALUE>false</VALUE></SETTING>
                    </SETTING>
                    <SETTING>
                        <SETTING><NAME>FileType</NAME><VALUE>TEXT</VALUE></SETTING>
                        <SETTING><NAME>FileExtension</NAME><VALUE>.cxgate</VALUE></SETTING>
                        <SETTING><NAME>Compiler</NAME><VALUE>Compiler for XGATE</VALUE></SETTING>
                        <SETTING><NAME>EditLanguage</NAME><VALUE>mwe_cpp_XGATE</VALUE></SETTING>
                        <SETTING><NAME>Precompile</NAME><VALUE>false</VALUE></SETTING>
                        <SETTING><NAME>Launchable</NAME><VALUE>false</VALUE></SETTING>
                        <SETTING><NAME>ResourceFile</NAME><VALUE>false</VALUE></SETTING>
                        <SETTING><NAME>IgnoredByMake</NAME><VALUE>false</VALUE></SETTING>
                    </SETTING>
                    <SETTING>
                        <SETTING><NAME>FileType</NAME><VALUE>TEXT</VALUE></SETTING>
                        <SETTING><NAME>FileExtension</NAME><VALUE>.cxx</VALUE></SETTING>
                        <SETTING><NAME>Compiler</NAME><VALUE>Compiler for HC12</VALUE></SETTING>
                        <SETTING><NAME>EditLanguage</NAME><VALUE>mwe_cpp_HC12</VALUE></SETTING>
                        <SETTING><NAME>Precompile</NAME><VALUE>false</VALUE></SETTING>
                        <SETTING><NAME>Launchable</NAME><VALUE>false</VALUE></SETTING>
                        <SETTING><NAME>ResourceFile</NAME><VALUE>false</VALUE></SETTING>
                        <SETTING><NAME>IgnoredByMake</NAME><VALUE>false</VALUE></SETTING>
                    </SETTING>
                    <SETTING>
                        <SETTING><NAME>FileType</NAME><VALUE>TEXT</VALUE></SETTING>
                        <SETTING><NAME>FileExtension</NAME><VALUE>.dbg</VALUE></SETTING>
                        <SETTING><NAME>Compiler</NAME><VALUE>Assembler for HC12</VALUE></SETTING>
                        <SETTING><NAME>EditLanguage</NAME><VALUE>mwe_asm_HC12</VALUE></SETTING>
                        <SETTING><NAME>Precompile</NAME><VALUE>false</VALUE></SETTING>
                        <SETTING><NAME>Launchable</NAME><VALUE>false</VALUE></SETTING>
                        <SETTING><NAME>ResourceFile</NAME><VALUE>false</VALUE></SETTING>
                        <SETTING><NAME>IgnoredByMake</NAME><VALUE>true</VALUE></SETTING>
                    </SETTING>
                    <SETTING>
                        <SETTING><NAME>FileType</NAME><VALUE>TEXT</VALUE></SETTING>
                        <SETTING><NAME>FileExtension</NAME><VALUE>.equ</VALUE></SETTING>
                        <SETTING><NAME>Compiler</NAME><VALUE>Assembler for HC12</VALUE></SETTING>
                        <SETTING><NAME>EditLanguage</NAME><VALUE>mwe_asm_HC12</VALUE></SETTING>
                        <SETTING><NAME>Precompile</NAME><VALUE>false</VALUE></SETTING>
                        <SETTING><NAME>Launchable</NAME><VALUE>false</VALUE></SETTING>
                        <SETTING><NAME>ResourceFile</NAME><VALUE>false</VALUE></SETTING>
                        <SETTING><NAME>IgnoredByMake</NAME><VALUE>true</VALUE></SETTING>
                    </SETTING>
                    <SETTING>
                        <SETTING><NAME>FileType</NAME><VALUE>TEXT</VALUE></SETTING>
                        <SETTING><NAME>FileExtension</NAME><VALUE>.h</VALUE></SETTING>
                        <SETTING><NAME>Compiler</NAME><VALUE>Compiler for HC12</VALUE></SETTING>
                        <SETTING><NAME>EditLanguage</NAME><VALUE>mwe_cpp_HC12</VALUE></SETTING>
                        <SETTING><NAME>Precompile</NAME><VALUE>false</VALUE></SETTING>
                        <SETTING><NAME>Launchable</NAME><VALUE>false</VALUE></SETTING>
                        <SETTING><NAME>ResourceFile</NAME><VALUE>false</VALUE></SETTING>
                        <SETTING><NAME>IgnoredByMake</NAME><VALUE>true</VALUE></SETTING>
                    </SETTING>
                    <SETTING>
                        <SETTING><NAME>FileType</NAME><VALUE>TEXT</VALUE></SETTING>
                        <SETTING><NAME>FileExtension</NAME><VALUE>.hpp</VALUE></SETTING>
                        <SETTING><NAME>Compiler</NAME><VALUE>Compiler for HC12</VALUE></SETTING>
                        <SETTING><NAME>EditLanguage</NAME><VALUE>mwe_cpp_HC12</VALUE></SETTING>
                        <SETTING><NAME>Precompile</NAME><VALUE>false</VALUE></SETTING>
                        <SETTING><NAME>Launchable</NAME><VALUE>false</VALUE></SETTING>
                        <SETTING><NAME>ResourceFile</NAME><VALUE>false</VALUE></SETTING>
                        <SETTING><NAME>IgnoredByMake</NAME><VALUE>true</VALUE></SETTING>
                    </SETTING>
                    <SETTING>
                        <SETTING><NAME>FileType</NAME><VALUE>TEXT</VALUE></SETTING>
                        <SETTING><NAME>FileExtension</NAME><VALUE>.hxx</VALUE></SETTING>
                        <SETTING><NAME>Compiler</NAME><VALUE>Compiler for HC12</VALUE></SETTING>
                        <SETTING><NAME>EditLanguage</NAME><VALUE>mwe_cpp_HC12</VALUE></SETTING>
                        <SETTING><NAME>Precompile</NAME><VALUE>false</VALUE></SETTING>
                        <SETTING><NAME>Launchable</NAME><VALUE>false</VALUE></SETTING>
                        <SETTING><NAME>ResourceFile</NAME><VALUE>false</VALUE></SETTING>
                        <SETTING><NAME>IgnoredByMake</NAME><VALUE>true</VALUE></SETTING>
                    </SETTING>
                    <SETTING>
                        <SETTING><NAME>FileType</NAME><VALUE>TEXT</VALUE></SETTING>
                        <SETTING><NAME>FileExtension</NAME><VALUE>.inc</VALUE></SETTING>
                        <SETTING><NAME>Compiler</NAME><VALUE>Assembler for HC12</VALUE></SETTING>
                        <SETTING><NAME>EditLanguage</NAME><VALUE>mwe_asm_HC12</VALUE></SETTING>
                        <SETTING><NAME>Precompile</NAME><VALUE>false</VALUE></SETTING>
                        <SETTING><NAME>Launchable</NAME><VALUE>false</VALUE></SETTING>
                        <SETTING><NAME>ResourceFile</NAME><VALUE>false</VALUE></SETTING>
                        <SETTING><NAME>IgnoredByMake</NAME><VALUE>true</VALUE></SETTING>
                    </SETTING>
                    <SETTING>
                        <SETTING><NAME>FileType</NAME><VALUE>TEXT</VALUE></SETTING>
                        <SETTING><NAME>FileExtension</NAME><VALUE>.ini</VALUE></SETTING>
                        <SETTING><NAME>Compiler</NAME><VALUE></VALUE></SETTING>
                        <SETTING><NAME>EditLanguage</NAME><VALUE></VALUE></SETTING>
                        <SETTING><NAME>Precompile</NAME><VALUE>false</VALUE></SETTING>
                        <SETTING><NAME>Launchable</NAME><VALUE>false</VALUE></SETTING>
                        <SETTING><NAME>ResourceFile</NAME><VALUE>false</VALUE></SETTING>
                        <SETTING><NAME>IgnoredByMake</NAME><VALUE>true</VALUE></SETTING>
                    </SETTING>
                    <SETTING>
                        <SETTING><NAME>FileType</NAME><VALUE>TEXT</VALUE></SETTING>
                        <SETTING><NAME>FileExtension</NAME><VALUE>.lst</VALUE></SETTING>
                        <SETTING><NAME>Compiler</NAME><VALUE></VALUE></SETTING>
                        <SETTING><NAME>EditLanguage</NAME><VALUE>mwe_imp_HC12</VALUE></SETTING>
                        <SETTING><NAME>Precompile</NAME><VALUE>false</VALUE></SETTING>
                        <SETTING><NAME>Launchable</NAME><VALUE>false</VALUE></SETTING>
                        <SETTING><NAME>ResourceFile</NAME><VALUE>false</VALUE></SETTING>
                        <SETTING><NAME>IgnoredByMake</NAME><VALUE>true</VALUE></SETTING>
                    </SETTING>
                    <SETTING>
                        <SETTING><NAME>FileType</NAME><VALUE>TEXT</VALUE></SETTING>
                        <SETTING><NAME>FileExtension</NAME><VALUE>.map</VALUE></SETTING>
                        <SETTING><NAME>Compiler</NAME><VALUE></VALUE></SETTING>
                        <SETTING><NAME>EditLanguage</NAME><VALUE></VALUE></SETTING>
                        <SETTING><NAME>Precompile</NAME><VALUE>false</VALUE></SETTING>
                        <SETTING><NAME>Launchable</NAME><VALUE>false</VALUE></SETTING>
                        <SETTING><NAME>ResourceFile</NAME><VALUE>false</VALUE></SETTING>
                        <SETTING><NAME>IgnoredByMake</NAME><VALUE>true</VALUE></SETTING>
                    </SETTING>
                    <SETTING>
                        <SETTING><NAME>FileType</NAME><VALUE>TEXT</VALUE></SETTING>
                        <SETTING><NAME>FileExtension</NAME><VALUE>.oil</VALUE></SETTING>
                        <SETTING><NAME>Compiler</NAME><VALUE>OSEK Sysgen</VALUE></SETTING>
                        <SETTING><NAME>EditLanguage</NAME><VALUE></VALUE></SETTING>
                        <SETTING><NAME>Precompile</NAME><VALUE>true</VALUE></SETTING>
                        <SETTING><NAME>Launchable</NAME><VALUE>true</VALUE></SETTING>
                        <SETTING><NAME>ResourceFile</NAME><VALUE>false</VALUE></SETTING>
                        <SETTING><NAME>IgnoredByMake</NAME><VALUE>false</VALUE></SETTING>
                    </SETTING>
                    <SETTING>
                        <SETTING><NAME>FileType</NAME><VALUE>TEXT</VALUE></SETTING>
                        <SETTING><NAME>FileExtension</NAME><VALUE>.pre</VALUE></SETTING>
                        <SETTING><NAME>Compiler</NAME><VALUE></VALUE></SETTING>
                        <SETTING><NAME>EditLanguage</NAME><VALUE>mwe_cpp_HC12</VALUE></SETTING>
                        <SETTING><NAME>Precompile</NAME><VALUE>false</VALUE></SETTING>
                        <SETTING><NAME>Launchable</NAME><VALUE>false</VALUE></SETTING>
                        <SETTING><NAME>ResourceFile</NAME><VALUE>false</VALUE></SETTING>
                        <SETTING><NAME>IgnoredByMake</NAME><VALUE>true</VALUE></SETTING>
                    </SETTING>
                    <SETTING>
                        <SETTING><NAME>FileType</NAME><VALUE>TEXT</VALUE></SETTING>
                        <SETTING><NAME>FileExtension</NAME><VALUE>.prm</VALUE></SETTING>
                        <SETTING><NAME>Compiler</NAME><VALUE></VALUE></SETTING>
                        <SETTING><NAME>EditLanguage</NAME><VALUE>mwe_prm</VALUE></SETTING>